{
  "schemaVersion": "0.1",
  "kind": "agent-conformance-capability-matrix",
  "matrixId": "phase3-cross-exporter",
  "targets": [
    {
      "targetId": "dom-jsdom",
      "family": "dom",
      "tier": "in-process"
    },
    {
      "targetId": "webmcp-compat",
      "family": "webmcp",
      "tier": "compatibility"
    },
    {
      "targetId": "webmcp-native",
      "family": "webmcp",
      "tier": "native-webmcp"
    },
    {
      "targetId": "mcp-sdk",
      "family": "mcp",
      "tier": "protocol"
    },
    {
      "targetId": "playwright-managed",
      "family": "playwright",
      "tier": "managed-engine"
    }
  ],
  "cases": [
    {
      "caseId": "DISC-01",
      "capability": "disc",
      "targets": [
        {
          "targetId": "dom-jsdom",
          "status": "supported"
        },
        {
          "targetId": "webmcp-compat",
          "status": "supported"
        },
        {
          "targetId": "webmcp-native",
          "status": "supported"
        },
        {
          "targetId": "mcp-sdk",
          "status": "supported"
        },
        {
          "targetId": "playwright-managed",
          "status": "supported"
        }
      ]
    },
    {
      "caseId": "DISC-02",
      "capability": "disc",
      "targets": [
        {
          "targetId": "dom-jsdom",
          "status": "supported"
        },
        {
          "targetId": "webmcp-compat",
          "status": "supported"
        },
        {
          "targetId": "webmcp-native",
          "status": "supported"
        },
        {
          "targetId": "mcp-sdk",
          "status": "supported"
        },
        {
          "targetId": "playwright-managed",
          "status": "supported"
        }
      ]
    },
    {
      "caseId": "SUCCESS-01",
      "capability": "success",
      "targets": [
        {
          "targetId": "dom-jsdom",
          "status": "supported"
        },
        {
          "targetId": "webmcp-compat",
          "status": "supported"
        },
        {
          "targetId": "webmcp-native",
          "status": "supported"
        },
        {
          "targetId": "mcp-sdk",
          "status": "supported"
        },
        {
          "targetId": "playwright-managed",
          "status": "supported"
        }
      ]
    },
    {
      "caseId": "SUCCESS-02",
      "capability": "success",
      "targets": [
        {
          "targetId": "dom-jsdom",
          "status": "supported"
        },
        {
          "targetId": "webmcp-compat",
          "status": "supported"
        },
        {
          "targetId": "webmcp-native",
          "status": "supported"
        },
        {
          "targetId": "mcp-sdk",
          "status": "supported"
        },
        {
          "targetId": "playwright-managed",
          "status": "supported"
        }
      ]
    },
    {
      "caseId": "INVALID-01",
      "capability": "invalid",
      "targets": [
        {
          "targetId": "dom-jsdom",
          "status": "supported"
        },
        {
          "targetId": "webmcp-compat",
          "status": "supported"
        },
        {
          "targetId": "webmcp-native",
          "status": "supported"
        },
        {
          "targetId": "mcp-sdk",
          "status": "supported"
        },
        {
          "targetId": "playwright-managed",
          "status": "supported"
        }
      ]
    },
    {
      "caseId": "STALE-01",
      "capability": "stale",
      "targets": [
        {
          "targetId": "dom-jsdom",
          "status": "supported"
        },
        {
          "targetId": "webmcp-compat",
          "status": "supported"
        },
        {
          "targetId": "webmcp-native",
          "status": "supported"
        },
        {
          "targetId": "mcp-sdk",
          "status": "supported"
        },
        {
          "targetId": "playwright-managed",
          "status": "supported"
        }
      ]
    },
    {
      "caseId": "REPLACED-01",
      "capability": "replaced",
      "targets": [
        {
          "targetId": "dom-jsdom",
          "status": "supported"
        },
        {
          "targetId": "webmcp-compat",
          "status": "supported"
        },
        {
          "targetId": "webmcp-native",
          "status": "supported"
        },
        {
          "targetId": "mcp-sdk",
          "status": "supported"
        },
        {
          "targetId": "playwright-managed",
          "status": "supported"
        }
      ]
    },
    {
      "caseId": "DENY-01",
      "capability": "deny",
      "targets": [
        {
          "targetId": "dom-jsdom",
          "status": "supported"
        },
        {
          "targetId": "webmcp-compat",
          "status": "supported"
        },
        {
          "targetId": "webmcp-native",
          "status": "supported"
        },
        {
          "targetId": "mcp-sdk",
          "status": "supported"
        },
        {
          "targetId": "playwright-managed",
          "status": "supported"
        }
      ]
    },
    {
      "caseId": "CONFIRM-01",
      "capability": "confirm",
      "targets": [
        {
          "targetId": "dom-jsdom",
          "status": "supported"
        },
        {
          "targetId": "webmcp-compat",
          "status": "supported"
        },
        {
          "targetId": "webmcp-native",
          "status": "supported"
        },
        {
          "targetId": "mcp-sdk",
          "status": "supported"
        },
        {
          "targetId": "playwright-managed",
          "status": "supported"
        }
      ]
    },
    {
      "caseId": "CONFIRM-02",
      "capability": "confirm",
      "targets": [
        {
          "targetId": "dom-jsdom",
          "status": "supported"
        },
        {
          "targetId": "webmcp-compat",
          "status": "supported"
        },
        {
          "targetId": "webmcp-native",
          "status": "supported"
        },
        {
          "targetId": "mcp-sdk",
          "status": "supported"
        },
        {
          "targetId": "playwright-managed",
          "status": "supported"
        }
      ]
    },
    {
      "caseId": "PRE-01",
      "capability": "pre",
      "targets": [
        {
          "targetId": "dom-jsdom",
          "status": "supported"
        },
        {
          "targetId": "webmcp-compat",
          "status": "supported"
        },
        {
          "targetId": "webmcp-native",
          "status": "supported"
        },
        {
          "targetId": "mcp-sdk",
          "status": "supported"
        },
        {
          "targetId": "playwright-managed",
          "status": "supported"
        }
      ]
    },
    {
      "caseId": "PRE-02",
      "capability": "pre",
      "targets": [
        {
          "targetId": "dom-jsdom",
          "status": "supported"
        },
        {
          "targetId": "webmcp-compat",
          "status": "supported"
        },
        {
          "targetId": "webmcp-native",
          "status": "supported"
        },
        {
          "targetId": "mcp-sdk",
          "status": "supported"
        },
        {
          "targetId": "playwright-managed",
          "status": "supported"
        }
      ]
    },
    {
      "caseId": "VERIFY-01",
      "capability": "verify",
      "targets": [
        {
          "targetId": "dom-jsdom",
          "status": "supported"
        },
        {
          "targetId": "webmcp-compat",
          "status": "supported"
        },
        {
          "targetId": "webmcp-native",
          "status": "supported"
        },
        {
          "targetId": "mcp-sdk",
          "status": "supported"
        },
        {
          "targetId": "playwright-managed",
          "status": "supported"
        }
      ]
    },
    {
      "caseId": "VERIFY-02",
      "capability": "verify",
      "targets": [
        {
          "targetId": "dom-jsdom",
          "status": "supported"
        },
        {
          "targetId": "webmcp-compat",
          "status": "supported"
        },
        {
          "targetId": "webmcp-native",
          "status": "supported"
        },
        {
          "targetId": "mcp-sdk",
          "status": "supported"
        },
        {
          "targetId": "playwright-managed",
          "status": "supported"
        }
      ]
    },
    {
      "caseId": "REPLAY-01",
      "capability": "replay",
      "targets": [
        {
          "targetId": "dom-jsdom",
          "status": "supported"
        },
        {
          "targetId": "webmcp-compat",
          "status": "supported"
        },
        {
          "targetId": "webmcp-native",
          "status": "supported"
        },
        {
          "targetId": "mcp-sdk",
          "status": "supported"
        },
        {
          "targetId": "playwright-managed",
          "status": "supported"
        }
      ]
    },
    {
      "caseId": "CONFLICT-01",
      "capability": "conflict",
      "targets": [
        {
          "targetId": "dom-jsdom",
          "status": "supported"
        },
        {
          "targetId": "webmcp-compat",
          "status": "supported"
        },
        {
          "targetId": "webmcp-native",
          "status": "supported"
        },
        {
          "targetId": "mcp-sdk",
          "status": "supported"
        },
        {
          "targetId": "playwright-managed",
          "status": "supported"
        }
      ]
    },
    {
      "caseId": "ORIGIN-01",
      "capability": "origin",
      "targets": [
        {
          "targetId": "dom-jsdom",
          "status": "supported"
        },
        {
          "targetId": "webmcp-compat",
          "status": "supported"
        },
        {
          "targetId": "webmcp-native",
          "status": "supported"
        },
        {
          "targetId": "mcp-sdk",
          "status": "supported"
        },
        {
          "targetId": "playwright-managed",